{
  "schema": 1,
  "source_root_px": [
    127,
    220
  ],
  "source_body_height_px": 182,
  "analysis": {
    "method": "llm",
    "author": "Codex visual source review",
    "confidence": 0.86,
    "notes": "Reviewed crown under hair, body axis and soles. Idle source translation varies between cells; root removes authored drift. Walk uses stable pelvis axis rather than swinging foot. Body height is anatomical, not alpha bounds. Pose variation is retained. Left is a deterministic source mirror, x_left=255-x_right; no runtime flip."
  }
}
